Name,Review,Overall Company Rating
Ancy Alexander,"In the heart of the city. Best location among all other IBM offices in my opinion. But if you want to stay away from the city, Mantras would be more ideal. Hard to find seating here.",4.4
Fazil Basha S N,Well managed and organised theIR OSRK,4.4
subbu165,Very good and well maintained campus. Very crowded as far as parking space is concerned.,4.4
Shravan Jain,Office is always a best place ;),4.4
Premananda Mohapatra,Used to work here!,4.4
Kishan Padmanabhan,One of the best place to work with nature environment,4.4
ANURAG SHARAN,Excellent work place with perfect environment and professional ethics.,4.4
Satendra Dixit,Good place to work,4.4
karuppiah S,It has beautiful compound. Our need to show the proof in the entrance to visit any company inside. …More,4.4
shruthi s,Good place to work. Lots of traffic during working hours.,4.4
Turtle,This is an amazing place to work at. This place is occupied by IBM India. Pleasant working environment.,4.4
Chaitra Rama Murthy,This is located in the Embassy Golf Links campus located on the Koramangala Indiranagar Intermediate Ring Road,4.4
arjun m,A very good place to work,4.4
Ravi Prakash,Awesome!!Employee friendly company.,4.4
Vineeth V,It's an IBM building inside Embassy golf links intermediate ring road Domlur,4.4
Ayyanna haveri,Awesome work place,4.4
Dnyaneshwar Takte,Nice working location,4.4
Divakar M R,My office. Love this place.,4.4
Abdul,Traffic need to be made to move smoothly,4.4
Alwyn Lobo,Business park accommodating IT firms.,4.4
KENNEDY HARRY SAGAYA MILKU,Very fantastic ambience and well maintained by the facility staffs,4.4
Arunprasad N,Well maintained work place.,4.4
Sandeep,Eye-Bee-M,4.4
Srini R (rsrini7),Nice place.,4.4
Neeks daredeveiler,Manyata,4.4
veena krishnaprasad,IBMer,4.4
Astha Agrawal,The place is pretty good. Nice work environment. Just that there is no canteen in the block except one at the ground floor which the other floors don't have access to.,4.4
Aditya Pawar,Had amazing Experience through an industrial held by our college in March 2020...!Thanks IBM,4.4
shaik farooq,"Good place to work , more flexibility, work from home options, but salary hikes are less everything is depend on manager",4.4
SAMARTH MR,Work work work other than nothing is there don't join as contract no job safety for contract one's..they will treat as slaves for contract people...,4.4
Reetesh Anand,"Love the architecture of the building, everything is unique and the greenery all around",4.4
rafat ali,"Awesome infrastructure, good cafeteria",4.4
Sugyan sahu,Good company n interior.,4.4
vijay Kumar,Best place for working..,4.4
Punit Bhardwaj,Good place to work,4.4
Sreeshilpa Sreedharan,Good people. Good place. Good learning,4.4
AV Thomas,"A good place to deliver your career ambitions , so that Your value in the Job market improves. Female IBMers have more value here. The processes are strong and it's violation is seriously audited.",4.4
Divya Gupta,Egl is located in domlur area and ambience is good here,4.4
Ruchik Divakaran,Best place to work in the midst of the city,4.4
Vadivelan Veerabhaskaran,One of the best technology park to work...,4.4
amandeep singh,Worked here for 4 years.One of the best tech parks where you can work..,4.4
Narayanan Subramanian,"Functional glass box. I feel a bit sad when Developers and offices don't insist on green, living buildings.Functionally efficient I suppose.",4.4
Derrick David,Very scenic place. Next to the good course. Parking might be a concern.,4.4
Sachin Panse,"EGL D IBM is a nice place to work, learn and earn.Its a good place to hang out for a while but is costly at the same time.",4.4
Gorev Khanna,One of the oldest IBM blocks i have ever known and still standing tall.,4.4
Shruthi Prakash,Loved it,4.4
Riya Manna,This office is quite big and is in EGL embassy golf links. Nice infrastructure.,4.4
Samta Saki,"Lovely place, beautiful campus and great employees 😀🙂",4.4
James Kurian,You can grow old with this company. Great place to work.,4.4
vikashini Chander,Cool work place,4.4
Raj Kumar,Very Nice infrastructure environment for workers,4.4
Mani Kandan,Good 😊,4.4
MANO,Nice and develop area ibm is a great company,4.4
Narasimha Reddy C,Worst experience in IBM.. don't keep glasses to drink water as part of cost cutting,4.4
Arjuna Krishnappa,Its a nice place to work and perfectly located in a great place.,4.4
Saravanababu Velu,I work here. Go for a small walk post lunch. Good greenies surrounded and very well maintained corporate work place,4.4
Sunil Angadi,Good IBM IT campus,4.4
Amit Kaldhone,"Nice campus, well managed. Good parking facility.",4.4
